Sl. No,Name of Incident,Date,Month,Year,Country,Type of Event,Place Name,Impact,Affected Population,Important Person/Group Responsible,Outcome,latitude,longitude
230,Treaty of BrestUnknownLitovsk,3,March,1918,Russia,International Treaty,"BrestUnknownLitovsk (now Brest, Belarus)","Ended Russia's participation in WWI, ceding vast territories to the Central Powers.",Russian Empire,Bolshevik Government,Negative,52.0996507,23.7636662
231,Kronstadt Rebellion,7,March,1921,Russia,Military Rebellion,Kronstadt,"A major revolt by sailors against the Soviet government's policies, brutally suppressed.","Sailors, Red Army",Bolshevik Government,Negative,59.9959303,29.7655452
232,Formation of the USSR,30,December,1922,Russia,Political,Soviet Russia,"Unified the Russian, Ukrainian, Belarusian, and Transcaucasian republics into a single federal state.",Citizens of member republics,"Vladimir Lenin, Soviet leadership",Positive,61.52401,105.318756
233,Collectivization of Agriculture,Unknown,Unknown,1929,Russia,Economic Policy,Soviet Union,Forced consolidation of individual peasant households into collective farms (kolkhozes and sovkhozes).,Peasants,Joseph Stalin,Negative,61.52401,105.318756
234,First FiveUnknownYear Plan Initiated,Unknown,Unknown,1928,Russia,Economic Policy,Soviet Union,"Aimed at rapid industrialization and collectivization of agriculture, setting high production goals.",Soviet workforce,Joseph Stalin,Mixed,61.52401,105.318756
235,SovietUnknownFinnish Winter War,30,November,1939,Russia,Military Conflict,Finland,"An attempt by the Soviet Union to annex Finnish territory, resulting in heavy casualties and international criticism.",Finnish and Soviet military,"Joseph Stalin, Soviet military",Negative,61.52401,105.318756
236,Siege of Leningrad,8,September,1941,Russia,Military Siege,Leningrad (now Saint Petersburg),"One of the longest and most destructive sieges in history, causing severe famine and casualties.","Civilians, Soviet military","Nazi Germany, Soviet Union",Negative,59.9310584,30.3609097
237,Battle of Stalingrad,17,July,1942,Russia,Military Battle,Stalingrad (now Volgograd),"A turning point in WWII on the Eastern Front, resulting in significant German losses.",Soviet and German military,"Soviet Union, Nazi Germany",Positive,48.708048,44.5133034
238,Moscow Conference of Foreign Ministers,19,October,1943,Russia,Diplomatic Meeting,Moscow,Led to discussions on postUnknownwar reorganization and laid the groundwork for the United Nations.,Allied nations,"Churchill, Roosevelt, Stalin",Positive,55.755826,37.6173
239,Yalta Conference,4,February,1945,Russia,International Conference,"Yalta, Crimea","Agreements on the postUnknownwar reorganization of Europe and Germany, setting the stage for the Cold War.",Allied powers,"Churchill, Roosevelt, Stalin",Mixed,44.4909462,34.1532686
240,Death of Joseph Stalin,5,March,1953,USSR,Political,Moscow,Marked the end of Stalin's rule and the beginning of the deUnknownStalinization process under his successors.,Soviet citizens,Unknown,Mixed,55.755826,37.6173
241,Launch of Sputnik 1,4,October,1957,USSR,Space Exploration,Baikonur Cosmodrome,Initiated the space age and the space race between the USSR and the United States.,Global population,Soviet space program,Positive,45.9645851,63.30524269999999
242,Cuban Missile Crisis,16,October,1962,USSR,International Crisis,Cuba,A 13Unknownday confrontation between the United States and the Soviet Union over Soviet ballistic missiles in Cuba.,Global population,"Nikita Khrushchev, John F. Kennedy",Negative,21.521757,-77.781167
243,Khrushchev's Secret Speech,25,February,1956,USSR,Political,Moscow,"Denounced the crimes of Joseph Stalin, marking the beginning of the deUnknownStalinization.","Soviet citizens, Communist Party members",Nikita Khrushchev,Positive,55.755826,37.6173
244,The Prague Spring and its Suppression,20,August,1968,USSR,Military Intervention,Czechoslovakia,A period of political liberalization in Czechoslovakia crushed by Soviet military intervention.,Czechoslovak citizens,Leonid Brezhnev,Negative,,
245,SovietUnknownAfghan War,24,December,1979,USSR,Military Conflict,Afghanistan,A costly and ultimately unsuccessful attempt by the Soviet Union to prop up a communist government.,Afghan and Soviet citizens,Leonid Brezhnev,Negative,33.93911,67.709953
246,Perestroika and Glasnost Reforms,Unknown,Unknown,1975,USSR,Political/Economic Reform,Soviet Union,Mikhail Gorbachev's policies of reforming the political system and increasing transparency.,Soviet citizens,Mikhail Gorbachev,Positive,,
247,Chernobyl Nuclear Disaster,26,April,1986,USSR,Nuclear Accident,"Chernobyl, Ukraine","The worst nuclear disaster in history, leading to significant health and environmental consequences.",Global population,Unknown,Negative,51.2763027,30.2218992
248,Fall of the Berlin Wall,9,November,1989,USSR,Political,"Berlin, Germany",Symbolized the end of the Cold War and the beginning of German reunification.,East and West Germans,Unknown,Positive,52.52000659999999,13.404954
249,Dissolution of the Soviet Union,26,December,1991,USSR,Political,Soviet Union,"Marked the end of the Soviet Union and the emergence of 15 independent republics, including Russia.",Citizens of former USSR,"Mikhail Gorbachev, Boris Yeltsin",Positive,,
250,Boris Yeltsin Elected as First President of Russia,12,June,1991,Russia,Political,Russia,Signified the transition towards democratic governance and market economics in postUnknownSoviet Russia.,Russian citizens,Boris Yeltsin,Positive,61.52401,105.318756
251,Constitutional Crisis in Russia,21,September,1993,Russia,Political Crisis,Moscow,A political standUnknownoff between the Russian president and the parliament culminated in military conflict.,Russian citizens,"Boris Yeltsin, Russian parliament",Negative,55.755826,37.6173
253,Financial Crisis in Russia,17,August,1998,Russia,Economic Crisis,Russia,"Led to the Russian government defaulting on its debt, causing significant economic turmoil.",Russian citizens,Russian government,Negative,61.52401,105.318756
254,Putin's First Presidential Term,7,May,2000,Russia,Political,Russia,"Marked the beginning of Vladimir Putin's long tenure in power, significantly impacting Russian politics.",Russian citizens,Vladimir Putin,Mixed,61.52401,105.318756
255,Moscow Theater Hostage Crisis,23,October,2002,Russia,Terrorism,Moscow,"A deadly siege carried out by Chechen terrorists, ending with numerous casualties.","Hostages, terrorists","Chechen terrorists, Russian security forces",Negative,55.755826,37.6173
256,Beslan School Siege,1,September,2004,Russia,Terrorism,"Beslan, North Ossetia","A terrorist attack resulting in over 330 deaths, including many children.",Beslan residents,"Chechen terrorists, Russian security forces",Negative,43.1945942,44.5167186
257,Russia's Annexation of Crimea,18,March,2014,Russia,Political/Territorial Change,Crimea,Led to international sanctions against Russia and significant geopolitical tensions.,"Ukrainians, Russians","Vladimir Putin, Russian government",Negative,61.52401,105.318756
258,Intervention in the Syrian Civil War,30,September,2015,Russia,Military Intervention,Syria,"Russia's military intervention on behalf of the Syrian government, affecting the course of the war.",Syrian population,"Vladimir Putin, Russian military",Mixed,61.52401,105.318756
259,Skripal Poisoning Incident,4,March,2018,Russia,International Incident,"Salisbury, UK","Led to a diplomatic crisis between Russia and Western countries, with accusations of Russian involvement.","Skripal family, UK citizens",Russian government (alleged),Negative,51.068785,-1.794472
260,Asuka Period Begins,Unknown,Unknown,538,Japan,Cultural/Political,Asuka,"Marked the introduction of Buddhism to Japan, influencing its culture and religion significantly.",Japanese society,"Soga no Umako, Prince Shotoku",Positive,34.4713594,135.8206452
261,Taika Reforms,Unknown,Unknown,645,Japan,Political,Japan,A set of doctrines established to reshape Japanese government and society along Chinese Confucian models.,Japanese society,Emperor Ktoku,Positive,36.204824,138.252924
262,Nara Period Begins,Unknown,Unknown,710,Japan,Cultural,Nara,"Establishment of the first permanent capital in Nara, leading to a flourishing of Japanese culture and arts.",Japanese society,Empress Genmei,Positive,34.685109,135.8048019
263,Heian Period Begins,Unknown,Unknown,794,Japan,Cultural,HeianUnknownky (Kyoto),"Marked the start of a golden age of art, culture, and literature in Japan.",Japanese society,Emperor Kanmu,Positive,35.011564,135.7681489
264,The Tale of Genji by Murasaki Shikibu,Unknown,Unknown,1030,Japan,Literature,HeianUnknownky (Kyoto),"Often considered the world's first novel, showcasing the sophistication of HeianUnknownera culture and society.","Japanese literature, global readership",Murasaki Shikibu,Positive,35.011564,135.7681489
265,Kamakura Shogunate Established,Unknown,Unknown,1185,Japan,Military/Political,Kamakura,"The establishment of the first shogunate in Japan, marking the beginning of feudalism and samurai dominance.",Japanese society,Minamoto no Yoritomo,Mixed,35.3192128,139.5466731
266,Mongol Invasions of Japan,Unknown,Unknown,1274,Japan,Military,Kyushu,"Failed attempts by the Mongol Empire to invade Japan, reinforcing the samurai's status and affecting Japanese medieval identity.",Japanese defenders,"Kublai Khan, Samurai defenders",Positive,32.59,130.8
267,Muromachi Period Begins,Unknown,Unknown,1336,Japan,Cultural/Political,"Muromachi, Kyoto","A period marked by civil wars and the establishment of the Ashikaga shogunate, leading to cultural developments like the tea ceremony and Noh theater.",Japanese society,Ashikaga Takauji,Mixed,34.972562,135.758591
268,Onin War,Unknown,Unknown,1467,Japan,Civil War,Kyoto,A conflict that led to the collapse of the Ashikaga shogunate's authority and the start of the Sengoku period.,Japanese society,Various daimys,Negative,35.011564,135.7681489
269,Introduction of Firearms by Portuguese,Unknown,Unknown,1543,Japan,Military/Technology,Tanegashima,Transformed warfare in Japan and led to significant changes in military tactics during the Sengoku period.,"Japanese warlords, samurai",Portuguese traders,Mixed,30.609558,130.9788775
270,AzuchiUnknownMomoyama Period Begins,Unknown,Unknown,1568,Japan,Cultural/Political,Azuchi,"Characterized by the unification of Japan under Oda Nobunaga and later Toyotomi Hideyoshi, leading to the establishment of a centralized government.",Japanese society,"Oda Nobunaga, Toyotomi Hideyoshi",Positive,35.1558183,136.1395424
271,Tokugawa Shogunate Established,Unknown,Unknown,1603,Japan,Political,Edo (Tokyo),"The establishment of the Tokugawa shogunate marked the beginning of over 250 years of peace and stability, known as the Edo period.",Japanese society,Tokugawa Ieyasu,Positive,35.6764225,139.650027
272,Sakoku Edict of 1635,Unknown,Unknown,1635,Japan,Foreign Policy,Japan,The isolationist foreign policy of the Tokugawa shogunate that restricted Japan's contact with most foreign countries.,Japanese society,Tokugawa Iemitsu,Mixed,36.204824,138.252924
273,Meiji Restoration,Unknown,Unknown,1868,Japan,Political,Japan,"The restoration of imperial rule under Emperor Meiji, leading to rapid modernization and westernization.",Japanese society,"Emperor Meiji, Meiji oligarchs",Positive,36.204824,138.252924
274,SinoUnknownJapanese War,Unknown,Unknown,1894,Japan,Military Conflict,"Korea, China","Established Japan as a formidable military power in East Asia, leading to the acquisition of Taiwan.",Chinese and Japanese Empires,Meiji Government,Positive,36.204824,138.252924
275,RussoUnknownJapanese War,Unknown,Unknown,1904,Japan,Military Conflict,"Manchuria, Korea","A significant victory for Japan, marking the first time an Asian power defeated a European power in modern times.",Russian and Japanese Empires,Meiji Government,Positive,36.204824,138.252924
276,Taisho Democracy,Unknown,Unknown,1912,Japan,Political,Japan,A period of democratic political reforms and increased political participation during the Taisho era.,Japanese society,Unknown,Mixed,36.204824,138.252924
277,Japanese Invasion of Manchuria,18,September,1931,Japan,Military Invasion,"Manchuria, China","Marked the beginning of Japan's aggressive expansion in East Asia, leading to the Second SinoUnknownJapanese War.",Chinese and Japanese populations,Imperial Japanese Army,Negative,36.204824,138.252924
278,Second SinoUnknownJapanese War,7,July,1937,Japan,Military Conflict,China,"A major theater of WWII in Asia, resulting in massive casualties and atrocities such as the Nanjing Massacre.",Chinese and Japanese civilians,Imperial Japanese Army,Negative,36.204824,138.252924
279,Atomic Bombings of Hiroshima and Nagasaki,6 and 9,August,1945,Japan,Military/Atomic Warfare,"Hiroshima, Nagasaki","Led to Japan's surrender in WWII, marking the first and only use of nuclear weapons in warfare.",Japanese civilians,United States,Negative,34.3852894,132.4553055
280,Perry Expedition and Opening of Japan,8,July,1853,Japan,International Relations,Edo Bay (Tokyo Bay),"Forced Japan to end its isolationist policy, leading to the Treaty of Kanagawa and opening Japan to the West.",Japanese society,Commodore Matthew Perry,Mixed,35.531074,139.8893534
281,Boshin War,Unknown,Unknown,1868,Japan,Civil War,Japan,A civil war between forces of the Tokugawa Shogunate and those seeking to return political power to the Imperial Court.,Japanese society,"Tokugawa Shogunate, Imperial loyalists",Positive,36.204824,138.252924
282,Iwakura Mission,Unknown,Unknown,1871,Japan,Diplomatic Mission,"USA, Europe",A Japanese diplomatic voyage to the United States and Europe to renegotiate unequal treaties and study Western ways.,Japanese society,"Iwakura Tomomi, Kido Takayoshi",Positive,36.204824,138.252924
283,Satsuma Rebellion,Unknown,Unknown,1877,Japan,Military Rebellion,Kyushu,"A revolt of disaffected samurai against the new imperial government, marking the end of samurai rebellion.","Japanese government, samurai",Saig Takamori,Negative,32.59,130.8
284,First SinoUnknownJapanese War,Unknown,Unknown,1894,Japan,Military Conflict,"Korea, China","Demonstrated Japan's military dominance in Asia, leading to the acquisition of Taiwan and Korea's independence.",Chinese and Japanese Empires,Meiji Government,Positive,36.204824,138.252924
285,JapanUnknownKorea Annexation Treaty,22,August,1910,Japan,International Agreement,Korea,"Officially annexed Korea, making it a part of the Japanese Empire until the end of World War II.",Korean population,Imperial Japan,Negative,36.204824,138.252924
286,Washington Naval Conference,Unknown,Unknown,1922,Japan,International Relations,Washington D.C.,Led to naval disarmament and attempted to prevent naval arms race among the major powers.,International community,"USA, UK, Japan, France, Italy",Positive,38.9039821,-77.0423689
287,Manchurian Incident,18,September,1931,Japan,Military Aggression,"Manchuria, China","A staged event used by Japan as a pretext to invade Manchuria, leading to the establishment of Manchukuo.",Chinese and Japanese populations,Imperial Japanese Army,Negative,36.204824,138.252924
288,Marco Polo Bridge Incident,7,July,1937,Japan,Military Conflict,"Near Beijing, China","The start of the fullUnknownscale Second SinoUnknownJapanese War, escalating conflict in East Asia.",Chinese and Japanese populations,"Imperial Japanese Army, Chinese forces",Negative,39.904211,116.407395
289,Japan's Surrender in World War II,2,September,1945,Japan,End of WWII,Tokyo Bay,Marked the end of World War II and the beginning of Japan's postUnknownwar reconstruction and pacifism era.,Japanese population,"Emperor Hirohito, Allied Powers",Negative,35.531074,139.8893534
290,San Francisco Peace Treaty Signed,8,September,1951,Japan,International Treaty,San Francisco,"Officially ended the state of war between Japan and the Allied Powers, restoring Japan's sovereignty.",Japanese population,Shigeru Yoshida (Prime Minister),Positive,37.7846321,-122.4313039
291,Japan Joins the United Nations,18,December,1956,Japan,International Relations,New York,Marked Japan's return to the international community and its commitment to global peace and cooperation.,Global community,Japanese government,Positive,40.7560919,-73.9741336
292,Income Doubling Plan Announced,Unknown,Unknown,1960,Japan,Economic Policy,Japan,"Aimed at doubling the national income, fueling rapid economic growth and improving living standards.",Japanese citizens,Hayato Ikeda (Prime Minister),Positive,36.204824,138.252924
293,Tokyo Olympics,10,October,1964,Japan,International Sports Event,Tokyo,"Showcased Japan's recovery and modernization to the world, fostering national pride and international goodwill.",Global audience,Japanese government,Positive,35.6764225,139.650027
294,Osaka Expo '70,15,March,1970,Japan,World's Fair,Osaka,Symbolized Japan's cultural and technological advancements on the world stage.,International visitors,Japanese government,Positive,34.6937249,135.5022535
295,Oil Crisis and Economic Shift,October,Unknown,1973,Japan,Economic Crisis,Japan,Prompted a shift in Japan's economy towards energyUnknownefficient industries and high technology.,Japanese economy,Japanese government,Mixed,36.204824,138.252924
296,JapanUnknownChina Joint Communiqu,29,September,1972,Japan,Diplomatic Agreement,Beijing,"Normalized diplomatic relations between Japan and China, ending the postUnknownwar state of hostility.",Japanese and Chinese populations,Kakuei Tanaka (Prime Minister),Positive,39.904211,116.407395
298,Heisei Era Begins,8,January,1989,Japan,Era Change,Japan,"The ascension of Emperor Akihito marked the beginning of the Heisei era, symbolizing peace and recovery.",Japanese population,Emperor Akihito,Positive,36.204824,138.252924
299,Great Hanshin Earthquake,17,January,1995,Japan,Natural Disaster,Kobe,"One of the deadliest earthquakes in Japan's history, leading to significant loss of life and damage.",Residents of affected area,Unknown,Negative,34.6900806,135.1956311
300,Aum Shinrikyo Tokyo Subway Sarin Attack,20,March,1995,Japan,Terrorism,Tokyo,"A deadly terrorist attack by a doomsday cult, shaking public security and trust in authorities.","Commuters, general public",Aum Shinrikyo cult,Negative,35.6764225,139.650027
302,Japan's Apology for WWII Aggressions,15,August,1995,Japan,Diplomatic Statement,Japan,Prime Minister Tomiichi Murayama issued a formal apology for Japan's wartime aggressions.,Asian neighbors,Tomiichi Murayama (Prime Minister),Positive,36.204824,138.252924
303,Kyoto Protocol on Climate Change,11,December,1997,Japan,International Agreement,Kyoto,"An international treaty committing its parties to reduce greenhouse gas emissions, based on the premise of global warming.",Global community,International participants,Positive,35.011564,135.7681489
305,Fukushima Daiichi Nuclear Disaster,11,March,2011,Japan,Nuclear Accident,Fukushima,"Triggered by a massive earthquake and tsunami, it was one of the worst nuclear disasters in history.","Residents of affected area, global community","TEPCO, Japanese government",Negative,37.7607991,140.4747856
306,JapanUnknownKorea Comfort Women Agreement,28,December,2015,Japan,Diplomatic Agreement,Seoul,"Aimed to resolve the longUnknownstanding issue of ""comfort women"" during WWII, though met with criticism and controversy.","Victims, South Korean and Japanese populations","Shinzo Abe (Prime Minister), Park GeunUnknownhye",Mixed,37.550263,126.9970831
307,Emperor Akihito's Abdication,30,April,2019,Japan,Historical,Tokyo,"Marked the first abdication of a Japanese emperor in over two centuries, leading to the Reiwa era.",Japanese population,Emperor Akihito,Positive,35.6764225,139.650027
308,2020 Tokyo Olympics Postponement,24,March,2020,Japan,International Sports Event,Tokyo,The Olympics were postponed for the first time in history due to the COVIDUnknown19 pandemic.,"Global audience, athletes","International Olympic Committee, Japanese government",Mixed,35.6764225,139.650027
309,Reiwa Era Begins,1,May,2019,Japan,Era Change,Japan,"The ascension of Emperor Naruhito marked the beginning of the Reiwa era, symbolizing harmony and peace.",Japanese population,Emperor Naruhito,Positive,36.204824,138.252924
310,Arrival of the First Fleet,26,January,1788,Australia,Colonial Settlement,Sydney Cove,"Marked the beginning of British colonization in Australia, leading to the establishment of New South Wales.","Indigenous Australians, British convicts",Captain Arthur Phillip,Mixed,-33.8685029,151.2198066
311,Establishment of the Colony of Van Diemen's Land,Unknown,Unknown,1803,Australia,Colonial Expansion,Tasmania,"Expanded British territorial claims in Australia, significantly impacting the indigenous population.","Tasmanian Aboriginal people, British settlers",British Colonial Administration,Negative,-42.0409059,146.8087322
312,Gold Rushes Begin,Unknown,Unknown,1851,Australia,Economic,"New South Wales, Victoria","Triggered mass migration to Australia, significantly boosting the economy and population.",Australian colonies,Gold prospectors,Positive,-31.2532183,146.921099
313,Eureka Stockade,3,December,1854,Australia,Rebellion,"Ballarat, Victoria","A miners' rebellion against colonial authorities, considered a pivotal event in the development of democracy in Australia.","Miners, colonial authorities",Peter Lalor,Positive,-37.5621587,143.8502556
314,Establishment of the Commonwealth of Australia,1,January,1901,Australia,Federation,Entire Australia,"Unification of the six colonies into a federated nation, marking the birth of modern Australia.",Australian population,Edmund Barton,Positive,-25.274398,133.775136
315,ANZAC troops land at Gallipoli,25,April,1915,Australia,Military,"Gallipoli, Turkey",Marked the first major military action fought by Australian and New Zealand forces during WWI.,ANZAC soldiers,Unknown,Negative,40.3333333,26.5
316,The Great Strike of 1917,Unknown,Unknown,1917,Australia,Labor Movement,Sydney,"One of Australia's largest industrial disputes, affecting the country's economy and labor laws.","Workers, employers",Union leaders,Mixed,-33.8688197,151.2092955
317,Women's Suffrage Achieved,Unknown,Unknown,1902,Australia,Political,Entire Australia,"Granted women the right to vote and stand for parliamentary election, a significant step for women's rights.",Australian women,Women's suffrage activists,Positive,-25.274398,133.775136
318,The Great Depression Hits Australia,Unknown,Unknown,1929,Australia,Economic Crisis,Entire Australia,"Severely affected Australia's economy, leading to widespread unemployment and social upheaval.",Australian population,Unknown,Negative,-25.274398,133.775136
319,Sydney Harbour Bridge Opens,19,March,1932,Australia,Infrastructure,Sydney,Became a national symbol of Australia and a critical transportation link within Sydney.,Sydney residents,John Bradfield,Positive,-33.8688197,151.2092955
320,Australian Citizenship Act,Unknown,Unknown,1949,Australia,Legal,Entire Australia,"Established Australian citizenship, formally distinguishing Australians from British subjects.",Australian residents,Australian Government,Positive,-25.274398,133.775136
321,Darwin Bombing by Japanese Forces,19,February,1942,Australia,Military,"Darwin, Northern Territory","The largest single attack ever mounted by a foreign power on Australia, bringing the realities of WWII to Australian shores.",Residents of Darwin,Imperial Japanese Navy,Negative,-12.4637333,130.8444446
322,Kokoda Trail Campaign,Unknown,Unknown,1942,Australia,Military,Papua New Guinea,"A series of battles fought in the New Guinea campaign of WWII, showcasing the bravery of Australian troops.","Australian soldiers, Papua New Guineans",Australian Army,Positive,-6.314992999999999,143.95555
323,Australian Involvement in WWII Begins,3,September,1939,Australia,Military,Global,Marked Australia's entry into WWII following the United Kingdom's declaration of war on Nazi Germany.,"Australian military, civilians",Robert Menzies (Prime Minister),Mixed,-25.274398,133.775136
324,Myall Creek Massacre,10,June,1838,Australia,Massacre,"Myall Creek, New South Wales",One of the most infamous incidents of violence against Indigenous Australians during the frontier wars.,Wirrayaraay people,European settlers,Negative,-29.7740019,150.7209404
325,The Founding of Melbourne,30,August,1835,Australia,Settlement,"Melbourne, Victoria","Establishment of Melbourne, which would grow to become one of Australia's largest and most influential cities.","Indigenous Australians, settlers","John Batman, settlers",Mixed,-37.8136276,144.9630576
326,The Shearers' Strike,Unknown,Unknown,1891,Australia,Labor Movement,Queensland,"A significant early labor dispute, highlighting the division between workers and employers in rural Australia.","Shearers, pastoralists","Union leaders, Queensland Government",Mixed,-22.575197,144.0847926
327,Federation of Australia,1,January,1901,Australia,Political,Entire Australia,"Unified the six separate British colonies into a single nation, the Commonwealth of Australia.",Residents of the colonies,Edmund Barton,Positive,-25.274398,133.775136
328,Australian Imperial Force's Formation,Unknown,Unknown,1914,Australia,Military Formation,Australia,Formation of the AIF marked Australia's preparation for participation in WWI.,Australian volunteers,Australian Government,Mixed,-25.274398,133.775136
329,Black Friday Bushfires,13,January,1939,Australia,Natural Disaster,Victoria,"One of Australia's worst natural disasters, leading to significant loss of life and property.",Residents of Victoria,Unknown,Negative,-36.9847807,143.3906074
330,Signing of the ANZUS Treaty,1,September,1951,Australia,International Relations,San Francisco,"Established a security alliance between Australia, New Zealand, and the United States, strengthening ties with the US.",Australian citizens,Robert Menzies (Prime Minister),Positive,-25.274398,133.775136
