Sl. No,Name of Incident,Date,Month,Year,Country,Type of Event,Place Name,Impact,Affected Population,Important Person/Group Responsible,Outcome,latitude,longitude
1,Indus Valley Civilization Flourishes,Unknown,Unknown,2600 BC,India,Civilization,Indus Valley,Development of one of the world's earliest urban civilizations,Local inhabitants,Indus Valley people,Positive,29.90451816438136,73.46428006668208
2,Battle of the Ten Kings,Unknown,Unknown,1400 BC,India,Battle,Punjab,Rigvedic tribes consolidated their control over the region,Rigvedic tribes,Sudas,Positive,31.1471305,75.34121789999999
6,Establishment of the Delhi Sultanate,Unknown,Unknown,1206,India,Political,Delhi,Muslim rule established in parts of India,People of Delhi and surrounding regions,QutbUnknownudUnknowndin Aibak,Mixed,28.6139298,77.2088282
7,Battle of Panipat,21,April,1526,India,Battle,Panipat,Foundation of the Mughal Empire in India,Northern Indian kingdoms,Babur,Mixed,29.3909464,76.9635023
8,Establishment of British Raj,1,May,1858,India,Colonial,Whole India,Start of direct British governance in India,Indian subcontinent,British East India Company/Empire,Negative,20.593684,78.96288
9,Partition of India,15,August,1947,India,Partition,India/Pakistan,Creation of India and Pakistan; massive population displacement and violence,"Hindus, Muslims, Sikhs","British Empire, Indian political leaders",Negative,30.375321,69.34511599999999
10,IndoUnknownPakistani War of 1971,3,December,1971,India,War,Bangladesh,Led to the independence of Bangladesh,Bengalis in East Pakistan,"Indian Military, Mukti Bahini",Negative,24.13556875,90.31065585
11,PokhranUnknownII Nuclear Tests,11,May,1998,India,Nuclear Test,Pokhran,India declared itself a nuclear state,International community,Atal Bihari Vajpayee,Mixed,26.9207919,71.92243549999999
12,Mumbai Terror Attacks,26,November,2008,India,Terrorism,Mumbai,Highlighted the threat of international terrorism,Citizens of Mumbai,LashkarUnknowneUnknownTaiba,Negative,19.0759837,72.8776559
13,Arrival of Vasco da Gama,20,May,1498,India,Exploration,Calicut,Marked the beginning of European colonial interests in India,Coastal communities,Vasco da Gama,Negative,11.2587531,75.78041
14,Battle of Plassey,23,June,1757,India,Battle,Plassey,Foundation for the expansion of British rule in India,Bengal and later all of India,East India Company,Negative,23.7832868,88.26071879999999
15,First War of Indian Independence,10,May,1857,India,Revolt,Meerut,First largeUnknownscale rebellion against British rule,"Rebels, British Raj","Indian soldiers, British East India Company",Negative,28.9844618,77.7064137
16,Swadeshi Movement,7,August,1905,India,National Movement,Bengal,Promoted Indian goods; protest against British economic policies,Indian nationalists,Indian National Congress,Positive,22.9867569,87.8549755
17,Green Revolution,Unknown,Unknown,1960,India,Agricultural Revolution,"Punjab, Haryana",Dramatically increased agricultural production,Indian farmers,"M.S. Swaminathan, Norman Borlaug",Positive,29.0587757,76.085601
18,Operation Blue Star,1,June,1984,India,Military Operation,Amritsar,Removal of armed militants from Golden Temple but led to controversy,Sikh community,"Indian Government, Sikh militants",Negative,31.6339793,74.8722642
19,Kargil War,Unknown,May,1999,India,Military Conflict,"Kargil, Ladakh",India regained control of Kargil; heightened patriotism,Indian Armed Forces,"Indian Government, Pakistani Military",Positive,34.5538522,76.1348944
20,Right to Information Act Enacted,15,June,2005,India,Legislation,India,Empowered citizens to seek information from public authorities,Indian citizens,Government of India,Positive,20.593684,78.96288
21,Nirbhaya Case,16,December,2012,India,Criminal Incident,New Delhi,Brought attention to women's safety and led to legal reforms,Indian women,"Indian society, Government of India",Positive,28.6139298,77.2088282
22,Launch of 5G Services,Unknown,October,2022,India,Technology,India,Introduction of 5G technology expected to revolutionize connectivity,"Indian consumers, businesses","Telecom companies, Government of India",Positive,20.593684,78.96288
23,Ram Mandir Bhoomi Pujan,5,August,2020,India,Cultural/Religious,Ayodhya,Beginning of the construction of Ram Temple at disputed site,Hindu community,"Government of India, Hindu activists",Positive,26.7921605,82.1997954
24,India's First Hyperloop Project Announcement,Unknown,February,2018,India,Infrastructure,Maharashtra,Proposal for highUnknownspeed transportation system,Potential commuters,"Virgin Hyperloop One, State Government",Positive,19.7514798,75.7138884
25,Indian Independence,15,August,1947,India,Political,India,End of British rule and birth of independent India,All citizens of India,"Indian National Congress, Muslim League",Positive,20.593684,78.96288
26,First General Elections,Unknown,October,1951,India,Political,India,Establishment of democratic governance,Indian electorate,Government of India,Positive,20.593684,78.96288
27,SinoUnknownIndian War,20,October,1962,India,Military Conflict,Border regions of India,Highlighted the border disputes and led to military and strategic changes,Border communities,"India, China",Negative,20.593684,78.96288
28,First Nuclear Test (Smiling Buddha),18,May,1974,India,Nuclear Test,"Pokhran, Rajasthan","India joins the nuclear club, changing its strategic position globally",International community,Government of India,Mixed,26.9207919,71.92243549999999
29,Emergency Declared by Indira Gandhi,25,June,1975,India,Political,India,Period of political unrest and curtailment of civil liberties,Indian citizens,"Indira Gandhi, Government of India",Negative,20.593684,78.96288
30,Bhopal Gas Tragedy,3,December,1984,India,Industrial Disaster,"Bhopal, Madhya Pradesh",World's worst industrial disaster,Residents of Bhopal,Union Carbide Corporation,Negative,23.2599333,77.412615
31,Economic Reforms and Liberalization,Unknown,July,1991,India,Economic Policy,India,Opening of the Indian economy to global markets and investors,"Indian businesses, workers","Manmohan Singh, P.V. Narasimha Rao",Positive,20.593684,78.96288
32,Kandahar Hijacking (IC 814),24,December,1999,India,Terrorism,"Kandahar, Afghanistan",Highlighted issues in aviation security and terrorism,"Passengers, crew","Hijackers, Indian Government",Negative,31.6205076,65.71581929999999
33,2001 Indian Parliament Attack,13,December,2001,India,Terrorism,New Delhi,Led to increased tensions between India and Pakistan,Indian political system,"Terrorist groups, Government of India",Negative,28.6139298,77.2088282
34,Right to Education Act,4,August,2009,India,Legislation,India,Ensured free and compulsory education for children,Children aged 6 to 14,Government of India,Positive,20.593684,78.96288
35,Article 370 Revocation for Jammu & Kashmir,5,August,2019,India,Political,Jammu & Kashmir,Changed the special status and autonomy of J&K,Residents of J&K,Government of India,Mixed,33.277839,75.34121789999999
36,Supreme Court Verdict on Ayodhya,9,November,2019,India,Judiciary,Ayodhya,Paved the way for the construction of a Ram Temple,Hindu and Muslim communities,Supreme Court of India,Mixed,26.7921605,82.1997954
37,Opening of BandraUnknownWorli Sea Link,30,June,2009,India,Infrastructure,Mumbai,Improved connectivity and reduced travel time in Mumbai,Commuters in Mumbai,Government of Maharashtra,Positive,19.0759837,72.8776559
38,Statue of Unity Unveiled,31,October,2018,India,Cultural/Political,Gujarat,"Became the world's tallest statue, symbolizing unity",Indian citizens,Government of India,Positive,22.6708317,71.5723953
39,Triple Talaq Bill Passed,30,July,2019,India,Legislation,India,Made instant triple talaq a criminal offence,Muslim women,Parliament of India,Positive,20.593684,78.96288
40,India's First Transgender University,Unknown,January,2020,India,Education,Uttar Pradesh,Empowered the transgender community through education,Transgender community,Dr. Akhilesh Das Gupta Foundation,Positive,27.5705886,80.0981869
41,Nationwide Lockdown due to COVIDUnknown19,24,March,2020,India,Public Health,India,Aimed to prevent the spread of COVIDUnknown19; significant economic impact,Entire population,Government of India,Negative,20.593684,78.96288
42,Historic Win in Cricket World Cup 1983,25,June,1983,India,Sports,"Lord's, England","Marked India's first Cricket World Cup win, boosting the sport's popularity",Indian sports fans,Indian cricket team,Positive,20.593684,78.96288
43,2013 Uttarakhand Floods,Unknown,June,2013,India,Natural Disaster,Uttarakhand,Severe floods causing massive destruction and loss of life,"Residents, pilgrims","State Government, National Disaster Response Force",Negative,30.066753,79.01929969999999
44,Indian Mars Orbiter Mission Success,24,September,2014,India,Space Exploration,Mars,"Made India the first Asian nation to reach Mars orbit, and at first attempt",Indian scientific community,ISRO,Positive,26.4546783,80.2798419
45,India Wins ICC T20 World Cup 2007,24,September,2007,India,Sports,South Africa,Boosted the popularity of T20 cricket in India and worldwide,Indian sports fans,Indian cricket team,Positive,-30.559482,22.937506
46,India's Demonetisation Campaign,8,November,2016,India,Economic Policy,Nationwide,"Aimed to curb illegal cash holdings, and promote digital transactions",Entire population,"Government of India, Prime Minister Narendra Modi",Mixed,20.593684,78.96288
47,Introduction of UPI (Unified Payment Interface),Unknown,April,2016,India,Financial Technology,Nationwide,"Revolutionized digital payments in India, making transactions simple and fast","Indian consumers, businesses",National Payments Corporation of India (NPCI),Positive,20.593684,78.96288
48,Jio Telecom Launch,5,September,2016,India,Telecommunications,Nationwide,Dramatically increased internet accessibility and usage in India,Indian population,Reliance Industries,Positive,20.593684,78.96288
49,Abolition of Instant Triple Talaq,30,July,2019,India,Legal,Nationwide,Protected Muslim women's rights by making instant triple talaq illegal,Muslim women,Parliament of India,Positive,20.593684,78.96288
50,Asiatic Lion Census Showing Population Increase,Unknown,May,2020,India,Wildlife Conservation,Gujarat,"Indicated successful conservation efforts, with an increase in the Asiatic lion population",Asiatic lions,"Wildlife Conservationists, Government of Gujarat",Positive,22.6708317,71.5723953
51,Decriminalisation of Section 377,6,September,2018,India,Legal,Nationwide,"Landmark judgement for LGBTQ+ rights in India, decriminalizing homosexuality",LGBTQ+ community,Supreme Court of India,Positive,20.593684,78.96288
52,Launch of ChandrayaanUnknown1,22,October,2008,India,Space Exploration,Moon,"India's first lunar mission, contributing significant findings like water molecules on Moon",Scientific community,Indian Space Research Organisation (ISRO),Positive,20.593684,78.96288
53,Start of Swachh Bharat Mission,2,October,2014,India,Environmental/Social,Nationwide,"Aimed at cleaning up the streets, roads and infrastructure of cities, towns, and rural areas",Indian population,"Government of India, Prime Minister Narendra Modi",Positive,20.593684,78.96288
54,Pulwama Terrorist Attack,14,February,2019,India,Terrorism,"Pulwama, Jammu and Kashmir",Led to a significant military and diplomatic standoff between India and Pakistan,Indian security forces,JaishUnknowneUnknownMohammed,Negative,33.8716117,74.89456919999999
55,Historic Solar Alliance Initiative,30,November,2015,India,International Cooperation,"Paris, France",India coUnknownlaunched the International Solar Alliance to promote solar energy globally,Global community,"Government of India, France",Positive,48.8575475,2.3513765
56,GST (Goods and Services Tax) Implementation,1,July,2017,India,Economic Reform,Nationwide,"Unified the country's tax system, replacing multiple indirect taxes with a single tax","Businesses, consumers",Government of India,Positive,20.593684,78.96288
57,Citizenship Amendment Act (CAA) Implementation,12,December,2019,India,Legislation,Nationwide,Led to widespread protests due to concerns over citizenship criteria based on religion,Indian citizens,Government of India,Mixed,20.593684,78.96288
58,2016 Uri Attack and Subsequent Surgical Strikes,18,September,2016,India,Military,"Uri, Jammu and Kashmir",Led to crossUnknownborder surgical strikes by India against militant launch pads in Pakistan,Military forces,Indian Army,Mixed,34.0881166,74.0339852
59,Formation of Indian National Congress,28,December,1885,India,Political Formation,Bombay,Aimed to obtain a greater share in government for educated Indians.,Indian political leaders,"Allan Octavian Hume, Indian leaders",Positive,19.0759837,72.8776559
60,Partition of Bengal,16,October,1905,India,Administrative,Bengal,Led to widespread nationalistic protests and was eventually reversed in 1911.,People of Bengal,Lord Curzon,Negative,22.9867569,87.8549755
61,Jallianwala Bagh Massacre,13,April,1919,India,Massacre,Amritsar,Galvanized the Indian population against British rule.,People of Amritsar,General Dyer,Negative,31.6339793,74.8722642
62,NonUnknownCooperation Movement,1,August,1920,India,Civil Disobedience Movement,Nationwide,"NonUnknownviolent resistance against British rule, emphasizing swaraj and swadeshi.",Indian civilians,Mahatma Gandhi,Positive,20.593684,78.96288
63,Chauri Chaura Incident,4,February,1922,India,Violent Protest,Chauri Chaura,Led to Gandhi halting the NonUnknownCooperation Movement due to violence.,Protesters,Indian protesters,Negative,26.650797,83.5856087
64,Dandi March,12,March,1930,India,Civil Disobedience,Dandi,"Protest against the salt tax and British monopoly, pivotal in the independence movement.","Mahatma Gandhi, followers",Mahatma Gandhi,Positive,21.3350822,72.6225087
65,First Round Table Conference,Unknown,November,1930,UK,Conference,London,Aimed at discussing constitutional reforms; boycotted by the Congress.,"Indian princely states, British officials",British government,Mixed,51.5072178,-0.1275862
66,Purna Swaraj Declaration,26,January,1930,India,Political Declaration,Lahore,The declaration of complete independence from British rule by the Congress.,Indian National Congress,Indian National Congress,Positive,31.5203696,74.35874729999999
67,Quit India Movement,8,August,1942,India,Mass Protest,Bombay,Called for an orderly British withdrawal from India.,"Indian National Congress, Indian civilians","Mahatma Gandhi, Indian National Congress",Positive,19.0759837,72.8776559
68,Cripps Mission,Unknown,March,1942,India,Negotiation,New Delhi,Proposed Indian dominion status after WWII; rejected by Indian leaders.,Indian leaders,Sir Stafford Cripps,Negative,28.6139298,77.2088282
69,Bengal Famine of 1943,Unknown,Unknown,1943,India,Famine,Bengal,Led to widespread criticism of British war policies and their impact on Indian civilians.,People of Bengal,British administration,Negative,22.9867569,87.8549755
70,Partition Plan Announced,3,June,1947,India,Political Decision,New Delhi,Announced the creation of India and Pakistan as separate nations.,People of India and Pakistan,Lord Mountbatten,Negative,28.6139298,77.2088282
71,Integration of Princely States,Unknown,Unknown,1947,India,Political Integration,Various,Unified India by integrating princely states into the Indian Union.,"Princely states, Indian Union",Sardar Vallabhbhai Patel,Positive,20.593684,78.96288
72,Constitution of India Adopted,26,January,1950,India,Constitutional Adoption,New Delhi,"India became a sovereign, socialist, secular, democratic republic.",Indian citizens,Constituent Assembly of India,Positive,28.6139298,77.2088282
79,Reserve Bank of India (RBI),1,April,1935,India,Central Banking Institution,Calcutta (now Kolkata),"Regulates the issue of banknotes, maintains reserves to secure monetary stability, and operates the currency and credit system of the country.","Indian economy, global investors",British Government (preUnknownindependence),Positive,22.5743545,88.3628734
80,Indian Space Research Organisation (ISRO),15,August,1969,India,Space Agency,Bangalore,"Leads India's space exploration and satellite deployment, contributing to national development and global space science.","Global scientific community, Indian population",Government of India,Positive,12.9715987,77.5945627
81,Bharatiya Janata Party (BJP),6,April,1980,India,Political Party,New Delhi,"Major political party in India, influencing the country's political landscape and governance policies.",Indian citizens,"Atal Bihari Vajpayee, L.K. Advani",Positive,28.6139298,77.2088282
82,Securities and Exchange Board of India (SEBI),12,April,1988,India,Regulatory Body,Mumbai,"Regulates the securities market in India, protecting investors and promoting the development of the securities market.","Investors, financial market participants",Government of India,Positive,19.0759837,72.8776559
83,Taj Mahal,Unknown,Unknown,1653,India,Mausoleum,Agra,"A UNESCO World Heritage Site, symbolizing love, and an architectural marvel of the Mughal era.","Global tourists, historians",Emperor Shah Jahan,Positive,27.1766701,78.00807449999999
84,Golden Temple (Harmandir Sahib),Unknown,Unknown,1585,India,Religious Shrine,Amritsar,"The spiritual and cultural center for the Sikh religion, known for its goldUnknownplated facade.","Sikhs, global pilgrims",Guru Arjan,Positive,31.6339793,74.8722642
85,Creation of Pakistan,14,August,1947,Pakistan,Country Formation,Pakistan,Establishment of Pakistan as a separate nation for Muslims of the Indian subcontinent.,Muslims in Indian subcontinent,Muhammad Ali Jinnah,Positive,30.375321,69.34511599999999
86,First IndoUnknownPak War,22,October,1947,Pakistan,Military Conflict,Kashmir,Conflict over the princely state of Kashmir leading to ongoing disputes.,Residents of Kashmir,India and Pakistan,Negative,33.9259055,73.7810334
87,Pakistan Joins the United Nations,30,September,1947,Pakistan,International Relations,New York,"Pakistan becomes a member of the UN, starting its journey in international diplomacy.",Global community,Government of Pakistan,Positive,40.7674618,-73.96955480000001
88,First Constitution of Pakistan,23,March,1956,Pakistan,Constitutional,Pakistan,"Pakistan becomes an Islamic republic, adopting its first constitution.",Pakistani citizens,Constituent Assembly of Pakistan,Positive,30.375321,69.34511599999999
89,East Pakistan demands autonomy,7,March,1971,Pakistan,Political Movement,Dhaka,Sheikh Mujibur Rahman's historic speech demanding autonomy for East Pakistan.,People of East Pakistan,Sheikh Mujibur Rahman,Mixed,30.375321,69.34511599999999
90,Independence of Bangladesh,16,December,1971,Pakistan,Country Formation,East Pakistan,"Resulted in the secession of East Pakistan, becoming Bangladesh.",People of Bangladesh,"Indian Armed Forces, Mukti Bahini",Mixed,30.375321,69.34511599999999
91,Pakistan's Nuclear Tests (ChagaiUnknownI),28,May,1998,Pakistan,Nuclear Test,"Chagai, Balochistan","Pakistan becomes a nuclear power, conducting its first successful nuclear tests.",International community,Government of Pakistan,Mixed,29.3057698,64.6944528
92,Kargil Conflict,Unknown,Unknown,1999,Pakistan,Military Conflict,"Kargil, Kashmir",A military conflict between India and Pakistan in the Kargil district of Kashmir.,Citizens of India and Pakistan,India and Pakistan,Negative,34.5538522,76.1348944
93,2005 Kashmir Earthquake,8,October,2005,Pakistan,Natural Disaster,"Kashmir, Pakistan","A devastating earthquake affecting Kashmir region, causing widespread damage and casualties.",Residents of Kashmir,"Government of Pakistan, International Aid",Negative,33.9259055,73.7810334
94,Assassination of Benazir Bhutto,27,December,2007,Pakistan,Political,Rawalpindi,The assassination of the former Prime Minister of Pakistan and a major political figure.,Pakistani citizens,Unknown assailants,Negative,33.5651107,73.0169135
95,Operation ZarbUnknowneUnknownAzb,15,June,2014,Pakistan,Military Operation,North Waziristan,A military operation against insurgent groups in North Waziristan part of the War on Terror.,Residents of North Waziristan,Pakistan Armed Forces,Positive,32.9430659,69.9550338
96,2014 Peshawar School Massacre,16,December,2014,Pakistan,Terrorism,Peshawar,"A terrorist attack on the Army Public School, resulting in massive casualties, mostly children.","Students, teachers, families",TehrikUnknowniUnknownTaliban Pakistan,Negative,34.0151366,71.5249154
97,ChinaUnknownPakistan Economic Corridor (CPEC) Agreement,20,April,2015,Pakistan,Economic/Infrastructure,Pakistan,A collection of infrastructure projects that are under construction throughout Pakistan.,Pakistani citizens,"Government of Pakistan, China",Positive,30.375321,69.34511599999999
98,Panama Papers Case & Disqualification of PM Nawaz Sharif,28,July,2017,Pakistan,Political Corruption,Islamabad,Led to the disqualification of Prime Minister Nawaz Sharif from holding public office.,Pakistani citizens,Supreme Court of Pakistan,Mixed,33.6995086,73.0362897
99,Kartarpur Corridor Opening,9,November,2019,Pakistan,Diplomatic/Religious,Kartarpur,"A border corridor between Pakistan and India, allowing Sikh pilgrims visaUnknownfree access to a holy site.",Sikh community,Governments of Pakistan and India,Positive,32.0879424,75.0151127
100,FATF Grey List,Unknown,Unknown,2018,Pakistan,International Finance,"Paris, France",Pakistan placed on the 'grey list' by the Financial Action Task Force for terror financing and money laundering risks.,Pakistani economy,Financial Action Task Force (FATF),Negative,48.8575475,2.3513765
101,Imran Khan Elected as Prime Minister,18,August,2018,Pakistan,Political,Islamabad,"Marks the first time a former cricketer transitioned to the Prime Minister, promising reform.",Pakistani citizens,Pakistan TehreekUnknowneUnknownInsaf (PTI),Positive,33.6995086,73.0362897
102,Abolition of FATA,31,May,2018,Pakistan,Administrative,Federally Administered Tribal Areas,"Integrated the tribal regions into the Khyber Pakhtunkhwa province, aiming to mainstream the governance.",Residents of FATA,Government of Pakistan,Positive,32.667476,69.8597406
103,2019 Pulwama Attack and IndiaUnknownPakistan Standoff,14,February,2019,Pakistan,Military/Political,"Pulwama, India","Led to heightened military tensions between India and Pakistan, including crossUnknownborder air strikes.",Citizens of India and Pakistan,"JaishUnknowneUnknownMohammed, Governments of India and Pakistan",Negative,33.8716117,74.89456919999999
104,MinarUnknowneUnknownPakistan Construction,23,March,1960,Pakistan,Monument,Lahore,Symbolizes freedom and the independence of Pakistan.,Pakistani citizens,Government of Pakistan,Positive,31.5203696,74.35874729999999
105,Lahore Resolution (Pakistan Resolution),23,March,1940,Pakistan,Political Declaration,Lahore,A formal political statement that called for greater Muslim autonomy in British India.,Muslims in British India,AllUnknownIndia Muslim League,Positive,31.5203696,74.35874729999999
106,Siachen Glacier Conflict,Unknown,Unknown,1984,Pakistan,Military Conflict,Siachen Glacier,A military conflict between India and Pakistan over the disputed Siachen Glacier region in Kashmir.,Indian & Pakistani militaries,India and Pakistan,Negative,35.4639008,77.0439012
107,Indus Water Treaty,19,September,1960,Pakistan,International Agreement,Karachi,"A waterUnknowndistribution treaty between India and Pakistan, brokered by the World Bank.",Residents of India and Pakistan,"India, Pakistan, World Bank",Positive,24.8607343,67.0011364
108,Pakistan Atomic Energy Commission Establishment,1956,Unknown,1956,Pakistan,Scientific Organization,Islamabad,Established to oversee the nuclear energy and research projects in Pakistan.,Pakistani population,Government of Pakistan,Positive,33.6995086,73.0362897
109,Nationalization in Pakistan,Unknown,Unknown,1972,Pakistan,Economic Policy,Nationwide,"The government took control of private industries, banks, and educational institutions.","Business owners, general public",Zulfikar Ali Bhutto,Mixed,30.375321,69.34511599999999
110,Islamabad Declaration,22,January,1980,Pakistan,International Relations,Islamabad,An Islamic summit that led to the creation of the Economic Cooperation Organization (ECO).,ECO member states,Leaders of MuslimUnknownmajority countries,Positive,33.6995086,73.0362897
111,Motorway Network Development,Unknown,Unknown,1997,Pakistan,Infrastructure,Nationwide,Development of a network of motorways to improve transportation and trade.,Pakistani citizens,Government of Pakistan,Positive,30.375321,69.34511599999999
112,Women's Protection Bill,15,November,2006,Pakistan,Legislation,Islamabad,Aims to amend and strengthen laws related to women's rights and protection.,Women in Pakistan,Parliament of Pakistan,Positive,33.6995086,73.0362897
113,Malala Yousafzai's Nobel Peace Prize,10,December,2014,Pakistan,International Recognition,"Oslo, Norway",Awarded for her struggle against the suppression of children and young people and for the right of all children to education.,Global community,"Malala Yousafzai, Kailash Satyarthi",Positive,59.9138688,10.7522454
114,ChinaUnknownPakistan Friendship Highway Completion,Unknown,Unknown,1986,Pakistan,Infrastructure,Khunjerab Pass to Hassan Abdal,"Part of the Karakoram Highway, symbolizing the strong bilateral relationship between China and Pakistan.","Residents, traders",Governments of China and Pakistan,Positive,33.8210214,72.6800204
115,Benazir Income Support Programme Launch,Unknown,Unknown,2008,Pakistan,Social Welfare Program,Nationwide,A federal unconditional cash transfer poverty reduction program in Pakistan.,LowUnknownincome families,Government of Pakistan,Positive,30.375321,69.34511599999999
116,18th Amendment to the Constitution,19,April,2010,Pakistan,Constitutional Amendment,Islamabad,A landmark amendment that devolved significant powers from the federal government to the provinces.,Pakistani citizens,Parliament of Pakistan,Positive,33.6995086,73.0362897
